{
  "schema": "apss.workspace-operation/v1",
  "execution_id": "exec-42",
  "operation_key": "exec-42:phase-1:fence-9:agent",
  "argv": [
    "agent",
    "--print",
    "--output-format",
    "stream-json"
  ],
  "working_directory": "repo",
  "environment": {
    "LANG": "C.UTF-8"
  },
  "credential_bindings": [
    {
      "ref": {
        "name": "github-app",
        "scope": "repo:acme/widgets"
      },
      "delivery": "env",
      "target": "GH_TOKEN"
    }
  ],
  "launch_marker": {
    "argv0": "agent-launch",
    "line": "APSS-LAUNCH 6f1e9c"
  },
  "timeout_seconds": 3600,
  "metadata": {
    "phase_id": "phase-1"
  }
}
